Host: kn064
/project/6106383/ewillis/pca_contrastive/venv/bin/python
Python 3.11.4
Mon Dec 15 00:10:17 2025       
+-----------------------------------------------------------------------------------------+
| NVIDIA-SMI 570.148.08             Driver Version: 570.148.08     CUDA Version: 12.8     |
|-----------------------------------------+------------------------+----------------------+
| GPU  Name                 Persistence-M | Bus-Id          Disp.A | Volatile Uncorr. ECC |
| Fan  Temp   Perf          Pwr:Usage/Cap |           Memory-Usage | GPU-Util  Compute M. |
|                                         |                        |               MIG M. |
|=========================================+========================+======================|
|   0  NVIDIA L40S                    On  |   00000000:CA:00.0 Off |                    0 |
| N/A   28C    P8             34W /  350W |       0MiB /  46068MiB |      0%      Default |
|                                         |                        |                  N/A |
+-----------------------------------------+------------------------+----------------------+
                                                                                         
+-----------------------------------------------------------------------------------------+
| Processes:                                                                              |
|  GPU   GI   CI              PID   Type   Process name                        GPU Memory |
|        ID   ID                                                               Usage      |
|=========================================================================================|
|  No running processes found                                                             |
+-----------------------------------------------------------------------------------------+
/project/6106383/ewillis/pca_contrastive/venv/lib/python3.11/site-packages/pydantic/_internal/_generate_schema.py:2249: UnsupportedFieldAttributeWarning: The 'repr' attribute with value False was provided to the `Field()` function, which has no effect in the context it was used. 'repr' is field-specific metadata, and can only be attached to a model field using `Annotated` metadata or by assignment. This may have happened because an `Annotated` type alias using the `type` statement was used, or if the `Field()` function was attached to a single member of a union type.
  warnings.warn(
/project/6106383/ewillis/pca_contrastive/venv/lib/python3.11/site-packages/pydantic/_internal/_generate_schema.py:2249: UnsupportedFieldAttributeWarning: The 'frozen' attribute with value True was provided to the `Field()` function, which has no effect in the context it was used. 'frozen' is field-specific metadata, and can only be attached to a model field using `Annotated` metadata or by assignment. This may have happened because an `Annotated` type alias using the `type` statement was used, or if the `Field()` function was attached to a single member of a union type.
  warnings.warn(
SCRIPT: train_no_attention.py
ARGS: Namespace(seed=42, manifest='/home/ewillis/projects/aip-medilab/shared/picai/manifests/slices_manifest.csv', sam_checkpoint='/project/aip-medilab/ewillis/pca_contrastive/mri_model_medsam_finetune/work_dir/MedSAM/medsam_vit_b.pth', outdir='/home/ewillis/projects/aip-medilab/ewillis/pca_contrastive/mri_model_medsam_finetune_2D/SPIE-no_attention/avgmax_results/baseline6', target='isup6', folds_train='1,2,3', folds_val='0', folds_test='4', batch_size=16, epochs=40, patience=10, lr=1e-05, wd=0.0, pos_ratio=0.33, proj_dim=512, use_skip=False, label6_column='merged_ISUP', pool_mode='avgmax', gem_p_init=3.0, freeze_epochs=2, wandb=True, wandb_project='mri-training', wandb_run_name='fixed-dims-noattn-isup6')
wandb: Currently logged in as: jesande7 (jesande7-queens) to https://api.wandb.ai. Use `wandb login --relogin` to force relogin
wandb: WARNING Changes to your `wandb` environment variables will be ignored because your `wandb` session has already started. For more information on how to modify your settings with `wandb.init()` arguments, please refer to https://wandb.me/wandb-init.
wandb: Tracking run with wandb version 0.21.2
wandb: Run data is saved locally in /project/6106383/shared/picai/wandb/run-20251215_001029-3vir3w6p
wandb: Run `wandb offline` to turn off syncing.
wandb: Syncing run fixed-dims-noattn-isup6
wandb: ⭐️ View project at https://wandb.ai/jesande7-queens/mri-training
wandb: 🚀 View run at https://wandb.ai/jesande7-queens/mri-training/runs/3vir3w6p
!!!!!! classes_present [0, 1, 2, 3, 4, 5]
[probe][epoch1 batch 00] has_lesion: 6/16 (38%) || labels: ISUP0=8 (50%) | ISUP1=2 (12%) | ISUP2=2 (12%) | ISUP3=2 (12%) | ISUP4=1 (6%) | ISUP5=1 (6%)
[probe][epoch1 batch 01] has_lesion: 9/16 (56%) || labels: ISUP0=7 (44%) | ISUP2=5 (31%) | ISUP3=3 (19%) | ISUP5=1 (6%)
[probe][epoch1 batch 02] has_lesion: 7/16 (44%) || labels: ISUP0=8 (50%) | ISUP1=1 (6%) | ISUP2=2 (12%) | ISUP3=1 (6%) | ISUP4=1 (6%) | ISUP5=3 (19%)
[probe][epoch1 batch 03] has_lesion: 6/16 (38%) || labels: ISUP0=10 (62%) | ISUP2=1 (6%) | ISUP3=4 (25%) | ISUP5=1 (6%)
[probe][epoch1 batch 04] has_lesion: 2/16 (12%) || labels: ISUP0=13 (81%) | ISUP1=1 (6%) | ISUP2=1 (6%) | ISUP5=1 (6%)
[probe][epoch1 batch 05] has_lesion: 7/16 (44%) || labels: ISUP0=7 (44%) | ISUP1=2 (12%) | ISUP2=1 (6%) | ISUP3=4 (25%) | ISUP4=1 (6%) | ISUP5=1 (6%)
[probe][epoch1 batch 06] has_lesion: 4/16 (25%) || labels: ISUP0=9 (56%) | ISUP1=3 (19%) | ISUP2=1 (6%) | ISUP3=2 (12%) | ISUP4=1 (6%)
[probe][epoch1 batch 07] has_lesion: 4/16 (25%) || labels: ISUP0=8 (50%) | ISUP1=4 (25%) | ISUP2=3 (19%) | ISUP3=1 (6%)
[001] train: loss 0.9858 bacc 0.1667 acc 0.1058 f1 0.0319 | val: loss 0.0222 acc 0.1795 BAL-acc 0.1667 f1 0.0507 | acc[c0]=0.000  acc[c1]=1.000  acc[c2]=0.000  acc[c3]=0.000  acc[c4]=0.000  acc[c5]=0.000 | auc[c0]=0.414  auc[c1]=0.528  auc[c2]=0.792  auc[c3]=0.857  auc[c4]=0.828  auc[c5]=0.865 | macroAUC=0.714 | macroSens=0.167 macroSpec=0.833 | sens[c0]=0.000  sens[c1]=1.000  sens[c2]=0.000  sens[c3]=0.000  sens[c4]=0.000  sens[c5]=0.000 | spec[c0]=1.000  spec[c1]=0.000  spec[c2]=1.000  spec[c3]=1.000  spec[c4]=1.000  spec[c5]=1.000
Confusion matrix (LR val): rows=true, cols=pred
true\pred   ISUP0   ISUP1   ISUP2   ISUP3   ISUP4   ISUP5
    ISUP0       0    5038       0       0       0       0
    ISUP1       0    1202       0       0       0       0
    ISUP2       0     231       0       0       0       0
    ISUP3       0     115       0       0       0       0
    ISUP4       0      36       0       0       0       0
    ISUP5       0      74       0       0       0       0
  ↳ saved best to /home/ewillis/projects/aip-medilab/ewillis/pca_contrastive/mri_model_medsam_finetune_2D/SPIE-no_attention/avgmax_results/baseline6/ckpt_best.pt (BAL-acc=0.1667)
[002] train: loss 0.8262 bacc 0.1709 acc 0.1056 f1 0.0396 | val: loss 0.0633 acc 0.1797 BAL-acc 0.1739 f1 0.0648 | acc[c0]=0.000  acc[c1]=0.998  acc[c2]=0.000  acc[c3]=0.017  acc[c4]=0.028  acc[c5]=0.000 | auc[c0]=0.398  auc[c1]=0.523  auc[c2]=0.812  auc[c3]=0.891  auc[c4]=0.861  auc[c5]=0.869 | macroAUC=0.726 | macroSens=0.174 macroSpec=0.833 | sens[c0]=0.000  sens[c1]=0.998  sens[c2]=0.000  sens[c3]=0.017  sens[c4]=0.028  sens[c5]=0.000 | spec[c0]=1.000  spec[c1]=0.002  spec[c2]=1.000  spec[c3]=0.999  spec[c4]=1.000  spec[c5]=0.999
Confusion matrix (LR val): rows=true, cols=pred
true\pred   ISUP0   ISUP1   ISUP2   ISUP3   ISUP4   ISUP5
    ISUP0       0    5034       0       1       1       2
    ISUP1       0    1200       0       2       0       0
    ISUP2       0     229       0       1       0       1
    ISUP3       0     113       0       2       0       0
    ISUP4       0      34       0       0       1       1
    ISUP5       0      73       0       0       1       0
  ↳ saved best to /home/ewillis/projects/aip-medilab/ewillis/pca_contrastive/mri_model_medsam_finetune_2D/SPIE-no_attention/avgmax_results/baseline6/ckpt_best.pt (BAL-acc=0.1739)
[003] train: loss 0.7121 bacc 0.2127 acc 0.1196 f1 0.1041 | val: loss 0.0513 acc 0.1797 BAL-acc 0.1816 f1 0.0759 | acc[c0]=0.000  acc[c1]=0.995  acc[c2]=0.000  acc[c3]=0.026  acc[c4]=0.028  acc[c5]=0.041 | auc[c0]=0.388  auc[c1]=0.513  auc[c2]=0.826  auc[c3]=0.889  auc[c4]=0.863  auc[c5]=0.856 | macroAUC=0.723 | macroSens=0.182 macroSpec=0.834 | sens[c0]=0.000  sens[c1]=0.995  sens[c2]=0.000  sens[c3]=0.026  sens[c4]=0.028  sens[c5]=0.041 | spec[c0]=1.000  spec[c1]=0.008  spec[c2]=1.000  spec[c3]=1.000  spec[c4]=0.999  spec[c5]=0.995
Confusion matrix (LR val): rows=true, cols=pred
true\pred   ISUP0   ISUP1   ISUP2   ISUP3   ISUP4   ISUP5
    ISUP0       0    5027       0       0       3       8
    ISUP1       0    1196       0       2       1       3
    ISUP2       0     224       0       0       0       7
    ISUP3       0      96       0       3       1      15
    ISUP4       0      34       0       0       1       1
    ISUP5       0      70       0       0       1       3
  ↳ saved best to /home/ewillis/projects/aip-medilab/ewillis/pca_contrastive/mri_model_medsam_finetune_2D/SPIE-no_attention/avgmax_results/baseline6/ckpt_best.pt (BAL-acc=0.1816)
[004] train: loss 0.7076 bacc 0.2708 acc 0.1379 f1 0.1700 | val: loss 0.4824 acc 0.1668 BAL-acc 0.2471 f1 0.0871 | acc[c0]=0.000  acc[c1]=0.879  acc[c2]=0.104  acc[c3]=0.000  acc[c4]=0.000  acc[c5]=0.500 | auc[c0]=0.426  auc[c1]=0.524  auc[c2]=0.823  auc[c3]=0.870  auc[c4]=0.872  auc[c5]=0.826 | macroAUC=0.724 | macroSens=0.247 macroSpec=0.835 | sens[c0]=0.000  sens[c1]=0.879  sens[c2]=0.104  sens[c3]=0.000  sens[c4]=0.000  sens[c5]=0.500 | spec[c0]=1.000  spec[c1]=0.143  spec[c2]=0.984  spec[c3]=0.997  spec[c4]=1.000  spec[c5]=0.887
Confusion matrix (LR val): rows=true, cols=pred
true\pred   ISUP0   ISUP1   ISUP2   ISUP3   ISUP4   ISUP5
    ISUP0       0    4525      60       6       2     445
    ISUP1       0    1056      27       6       0     113
    ISUP2       0     111      24       5       0      91
    ISUP3       0      30       8       0       0      77
    ISUP4       0      12       4       0       0      20
    ISUP5       0      29       7       1       0      37
  ↳ saved best to /home/ewillis/projects/aip-medilab/ewillis/pca_contrastive/mri_model_medsam_finetune_2D/SPIE-no_attention/avgmax_results/baseline6/ckpt_best.pt (BAL-acc=0.2471)
[005] train: loss 0.6295 bacc 0.2995 acc 0.1493 f1 0.1933 | val: loss 0.1098 acc 0.1780 BAL-acc 0.2046 f1 0.0891 | acc[c0]=0.000  acc[c1]=0.975  acc[c2]=0.017  acc[c3]=0.017  acc[c4]=0.056  acc[c5]=0.162 | auc[c0]=0.392  auc[c1]=0.516  auc[c2]=0.835  auc[c3]=0.896  auc[c4]=0.877  auc[c5]=0.854 | macroAUC=0.728 | macroSens=0.205 macroSpec=0.834 | sens[c0]=0.000  sens[c1]=0.975  sens[c2]=0.017  sens[c3]=0.017  sens[c4]=0.056  sens[c5]=0.162 | spec[c0]=1.000  spec[c1]=0.032  spec[c2]=1.000  spec[c3]=0.998  spec[c4]=0.989  spec[c5]=0.985
Confusion matrix (LR val): rows=true, cols=pred
true\pred   ISUP0   ISUP1   ISUP2   ISUP3   ISUP4   ISUP5
    ISUP0       0    4970       2       4      27      35
    ISUP1       0    1172       0       1      17      12
    ISUP2       0     191       4       3      11      22
    ISUP3       0      75       0       2      13      25
    ISUP4       0      27       1       1       2       5
    ISUP5       0      53       0       1       8      12
  ↳ no improvement (1/10)
[006] train: loss 0.6851 bacc 0.3262 acc 0.1603 f1 0.2203 | val: loss 0.1030 acc 0.1797 BAL-acc 0.2089 f1 0.1073 | acc[c0]=0.000  acc[c1]=0.978  acc[c2]=0.035  acc[c3]=0.104  acc[c4]=0.056  acc[c5]=0.081 | auc[c0]=0.390  auc[c1]=0.512  auc[c2]=0.841  auc[c3]=0.892  auc[c4]=0.881  auc[c5]=0.852 | macroAUC=0.728 | macroSens=0.209 macroSpec=0.834 | sens[c0]=0.000  sens[c1]=0.978  sens[c2]=0.035  sens[c3]=0.104  sens[c4]=0.056  sens[c5]=0.081 | spec[c0]=1.000  spec[c1]=0.029  spec[c2]=0.998  spec[c3]=0.990  spec[c4]=0.994  spec[c5]=0.994
Confusion matrix (LR val): rows=true, cols=pred
true\pred   ISUP0   ISUP1   ISUP2   ISUP3   ISUP4   ISUP5
    ISUP0       0    4984       5      22      13      14
    ISUP1       0    1175       2      13       9       3
    ISUP2       0     194       8      21       3       5
    ISUP3       0      79       0      12       8      16
    ISUP4       0      27       1       1       2       5
    ISUP5       0      53       2       7       6       6
  ↳ no improvement (2/10)
[007] train: loss 0.5800 bacc 0.3758 acc 0.1791 f1 0.2657 | val: loss 0.1323 acc 0.1791 BAL-acc 0.2119 f1 0.0980 | acc[c0]=0.000  acc[c1]=0.969  acc[c2]=0.065  acc[c3]=0.035  acc[c4]=0.000  acc[c5]=0.203 | auc[c0]=0.397  auc[c1]=0.517  auc[c2]=0.843  auc[c3]=0.890  auc[c4]=0.883  auc[c5]=0.847 | macroAUC=0.729 | macroSens=0.212 macroSpec=0.834 | sens[c0]=0.000  sens[c1]=0.969  sens[c2]=0.065  sens[c3]=0.035  sens[c4]=0.000  sens[c5]=0.203 | spec[c0]=1.000  spec[c1]=0.043  spec[c2]=0.994  spec[c3]=0.994  spec[c4]=0.998  spec[c5]=0.978
Confusion matrix (LR val): rows=true, cols=pred
true\pred   ISUP0   ISUP1   ISUP2   ISUP3   ISUP4   ISUP5
    ISUP0       0    4936      21      15       4      62
    ISUP1       0    1165      10       5       5      17
    ISUP2       0     172      15      14       0      30
    ISUP3       0      75       4       4       2      30
    ISUP4       0      25       2       1       0       8
    ISUP5       0      50       5       3       1      15
  ↳ no improvement (3/10)
[008] train: loss 0.6408 bacc 0.3726 acc 0.1786 f1 0.2687 | val: loss 0.3258 acc 0.1746 BAL-acc 0.2416 f1 0.1099 | acc[c0]=0.000  acc[c1]=0.920  acc[c2]=0.100  acc[c3]=0.200  acc[c4]=0.000  acc[c5]=0.230 | auc[c0]=0.417  auc[c1]=0.515  auc[c2]=0.838  auc[c3]=0.888  auc[c4]=0.875  auc[c5]=0.836 | macroAUC=0.728 | macroSens=0.242 macroSpec=0.835 | sens[c0]=0.000  sens[c1]=0.920  sens[c2]=0.100  sens[c3]=0.200  sens[c4]=0.000  sens[c5]=0.230 | spec[c0]=1.000  spec[c1]=0.101  spec[c2]=0.981  spec[c3]=0.968  spec[c4]=0.999  spec[c5]=0.963
Confusion matrix (LR val): rows=true, cols=pred
true\pred   ISUP0   ISUP1   ISUP2   ISUP3   ISUP4   ISUP5
    ISUP0       0    4713      64     115       5     141
    ISUP1       0    1106      31      39       2      24
    ISUP2       0     129      23      42       0      37
    ISUP3       0      48      12      23       1      31
    ISUP4       0      14       6       4       0      12
    ISUP5       0      33      11      12       1      17
  ↳ no improvement (4/10)
[009] train: loss 0.6467 bacc 0.4268 acc 0.1967 f1 0.3213 | val: loss 0.1393 acc 0.1785 BAL-acc 0.2233 f1 0.1055 | acc[c0]=0.000  acc[c1]=0.966  acc[c2]=0.069  acc[c3]=0.017  acc[c4]=0.139  acc[c5]=0.149 | auc[c0]=0.392  auc[c1]=0.505  auc[c2]=0.846  auc[c3]=0.892  auc[c4]=0.887  auc[c5]=0.843 | macroAUC=0.728 | macroSens=0.223 macroSpec=0.834 | sens[c0]=0.000  sens[c1]=0.966  sens[c2]=0.069  sens[c3]=0.017  sens[c4]=0.139  sens[c5]=0.149 | spec[c0]=1.000  spec[c1]=0.046  spec[c2]=0.996  spec[c3]=0.998  spec[c4]=0.983  spec[c5]=0.984
Confusion matrix (LR val): rows=true, cols=pred
true\pred   ISUP0   ISUP1   ISUP2   ISUP3   ISUP4   ISUP5
    ISUP0       0    4932      11       4      44      47
    ISUP1       0    1161       9       0      24       8
    ISUP2       0     169      16       9      17      20
    ISUP3       0      69       1       2      20      23
    ISUP4       0      24       1       0       5       6
    ISUP5       0      47       5       1      10      11
  ↳ no improvement (5/10)
[010] train: loss 0.5729 bacc 0.4418 acc 0.2039 f1 0.3336 | val: loss 0.3420 acc 0.1728 BAL-acc 0.2535 f1 0.1048 | acc[c0]=0.000  acc[c1]=0.911  acc[c2]=0.134  acc[c3]=0.000  acc[c4]=0.111  acc[c5]=0.365 | auc[c0]=0.438  auc[c1]=0.517  auc[c2]=0.832  auc[c3]=0.873  auc[c4]=0.874  auc[c5]=0.836 | macroAUC=0.729 | macroSens=0.254 macroSpec=0.835 | sens[c0]=0.000  sens[c1]=0.911  sens[c2]=0.134  sens[c3]=0.000  sens[c4]=0.111  sens[c5]=0.365 | spec[c0]=1.000  spec[c1]=0.111  spec[c2]=0.984  spec[c3]=0.999  spec[c4]=0.983  spec[c5]=0.935
Confusion matrix (LR val): rows=true, cols=pred
true\pred   ISUP0   ISUP1   ISUP2   ISUP3   ISUP4   ISUP5
    ISUP0       0    4675      48       4      58     253
    ISUP1       0    1095      36       1      19      51
    ISUP2       0     121      31       4       8      67
    ISUP3       0      44       8       0      19      44
    ISUP4       0      13       3       0       4      16
    ISUP5       0      31       8       0       8      27
  ↳ saved best to /home/ewillis/projects/aip-medilab/ewillis/pca_contrastive/mri_model_medsam_finetune_2D/SPIE-no_attention/avgmax_results/baseline6/ckpt_best.pt (BAL-acc=0.2535)
[011] train: loss 0.5373 bacc 0.4491 acc 0.2130 f1 0.3510 | val: loss 0.2353 acc 0.1797 BAL-acc 0.2460 f1 0.1307 | acc[c0]=0.000  acc[c1]=0.933  acc[c2]=0.208  acc[c3]=0.226  acc[c4]=0.028  acc[c5]=0.081 | auc[c0]=0.422  auc[c1]=0.522  auc[c2]=0.837  auc[c3]=0.883  auc[c4]=0.885  auc[c5]=0.840 | macroAUC=0.732 | macroSens=0.246 macroSpec=0.836 | sens[c0]=0.000  sens[c1]=0.933  sens[c2]=0.208  sens[c3]=0.226  sens[c4]=0.028  sens[c5]=0.081 | spec[c0]=1.000  spec[c1]=0.086  spec[c2]=0.966  spec[c3]=0.974  spec[c4]=0.997  spec[c5]=0.990
Confusion matrix (LR val): rows=true, cols=pred
true\pred   ISUP0   ISUP1   ISUP2   ISUP3   ISUP4   ISUP5
    ISUP0       0    4785     120      92       8      33
    ISUP1       0    1122      49      25       5       1
    ISUP2       0     131      48      42       0      10
    ISUP3       0      56      18      26       4      11
    ISUP4       0      15       7       5       1       8
    ISUP5       0      34      24       8       2       6
  ↳ no improvement (1/10)
[012] train: loss 0.5122 bacc 0.4667 acc 0.2225 f1 0.3645 | val: loss 0.0824 acc 0.1798 BAL-acc 0.2039 f1 0.0903 | acc[c0]=0.000  acc[c1]=0.983  acc[c2]=0.022  acc[c3]=0.043  acc[c4]=0.000  acc[c5]=0.176 | auc[c0]=0.397  auc[c1]=0.515  auc[c2]=0.844  auc[c3]=0.888  auc[c4]=0.883  auc[c5]=0.854 | macroAUC=0.730 | macroSens=0.204 macroSpec=0.834 | sens[c0]=0.000  sens[c1]=0.983  sens[c2]=0.022  sens[c3]=0.043  sens[c4]=0.000  sens[c5]=0.176 | spec[c0]=1.000  spec[c1]=0.032  spec[c2]=0.998  spec[c3]=0.992  spec[c4]=0.999  spec[c5]=0.984
Confusion matrix (LR val): rows=true, cols=pred
true\pred   ISUP0   ISUP1   ISUP2   ISUP3   ISUP4   ISUP5
    ISUP0       0    4978       3      17       4      36
    ISUP1       0    1181       1      10       2       8
    ISUP2       0     183       5      20       0      23
    ISUP3       0      79       2       5       1      28
    ISUP4       0      26       1       1       0       8
    ISUP5       0      53       3       5       0      13
  ↳ no improvement (2/10)
[013] train: loss 0.5056 bacc 0.4911 acc 0.2279 f1 0.3852 | val: loss 0.1356 acc 0.1791 BAL-acc 0.2286 f1 0.0987 | acc[c0]=0.000  acc[c1]=0.970  acc[c2]=0.039  acc[c3]=0.009  acc[c4]=0.083  acc[c5]=0.270 | auc[c0]=0.413  auc[c1]=0.517  auc[c2]=0.840  auc[c3]=0.882  auc[c4]=0.880  auc[c5]=0.848 | macroAUC=0.730 | macroSens=0.229 macroSpec=0.835 | sens[c0]=0.000  sens[c1]=0.970  sens[c2]=0.039  sens[c3]=0.009  sens[c4]=0.083  sens[c5]=0.270 | spec[c0]=1.000  spec[c1]=0.052  spec[c2]=0.999  spec[c3]=0.997  spec[c4]=0.990  spec[c5]=0.971
Confusion matrix (LR val): rows=true, cols=pred
true\pred   ISUP0   ISUP1   ISUP2   ISUP3   ISUP4   ISUP5
    ISUP0       0    4909       3       7      30      89
    ISUP1       0    1166       2       2      15      17
    ISUP2       0     161       9      12       5      44
    ISUP3       0      73       1       1      11      29
    ISUP4       0      21       1       1       3      10
    ISUP5       0      46       2       0       6      20
  ↳ no improvement (3/10)
[014] train: loss 0.4825 bacc 0.5171 acc 0.2438 f1 0.4094 | val: loss 0.3041 acc 0.1735 BAL-acc 0.2659 f1 0.1235 | acc[c0]=0.000  acc[c1]=0.913  acc[c2]=0.113  acc[c3]=0.130  acc[c4]=0.250  acc[c5]=0.189 | auc[c0]=0.442  auc[c1]=0.522  auc[c2]=0.837  auc[c3]=0.854  auc[c4]=0.875  auc[c5]=0.823 | macroAUC=0.725 | macroSens=0.266 macroSpec=0.835 | sens[c0]=0.000  sens[c1]=0.913  sens[c2]=0.113  sens[c3]=0.130  sens[c4]=0.250  sens[c5]=0.189 | spec[c0]=1.000  spec[c1]=0.107  spec[c2]=0.980  spec[c3]=0.970  spec[c4]=0.980  spec[c5]=0.975
Confusion matrix (LR val): rows=true, cols=pred
true\pred   ISUP0   ISUP1   ISUP2   ISUP3   ISUP4   ISUP5
    ISUP0       0    4687      67     115      70      99
    ISUP1       0    1098      32      34      27      11
    ISUP2       0     123      26      44      10      28
    ISUP3       0      47      13      15      20      20
    ISUP4       0      14       3       1       9       9
    ISUP5       0      34      12       6       8      14
  ↳ saved best to /home/ewillis/projects/aip-medilab/ewillis/pca_contrastive/mri_model_medsam_finetune_2D/SPIE-no_attention/avgmax_results/baseline6/ckpt_best.pt (BAL-acc=0.2659)
[015] train: loss 0.4436 bacc 0.5159 acc 0.2451 f1 0.4133 | val: loss 0.3429 acc 0.1711 BAL-acc 0.2424 f1 0.1099 | acc[c0]=0.000  acc[c1]=0.899  acc[c2]=0.091  acc[c3]=0.261  acc[c4]=0.028  acc[c5]=0.176 | auc[c0]=0.454  auc[c1]=0.524  auc[c2]=0.829  auc[c3]=0.855  auc[c4]=0.864  auc[c5]=0.817 | macroAUC=0.724 | macroSens=0.242 macroSpec=0.835 | sens[c0]=0.000  sens[c1]=0.899  sens[c2]=0.091  sens[c3]=0.261  sens[c4]=0.028  sens[c5]=0.176 | spec[c0]=1.000  spec[c1]=0.124  spec[c2]=0.977  spec[c3]=0.936  spec[c4]=0.997  spec[c5]=0.977
Confusion matrix (LR val): rows=true, cols=pred
true\pred   ISUP0   ISUP1   ISUP2   ISUP3   ISUP4   ISUP5
    ISUP0       0    4608      86     240      12      92
    ISUP1       0    1081      29      74       3      15
    ISUP2       0     111      21      82       0      17
    ISUP3       0      45      15      30       5      20
    ISUP4       0      15       5       6       1       9
    ISUP5       0      32      12      16       1      13
  ↳ no improvement (1/10)
[016] train: loss 0.4338 bacc 0.5387 acc 0.2466 f1 0.4318 | val: loss 0.2402 acc 0.1753 BAL-acc 0.2302 f1 0.1078 | acc[c0]=0.000  acc[c1]=0.927  acc[c2]=0.139  acc[c3]=0.113  acc[c4]=0.000  acc[c5]=0.203 | auc[c0]=0.443  auc[c1]=0.527  auc[c2]=0.834  auc[c3]=0.859  auc[c4]=0.861  auc[c5]=0.822 | macroAUC=0.724 | macroSens=0.230 macroSpec=0.835 | sens[c0]=0.000  sens[c1]=0.927  sens[c2]=0.139  sens[c3]=0.113  sens[c4]=0.000  sens[c5]=0.203 | spec[c0]=1.000  spec[c1]=0.093  spec[c2]=0.975  spec[c3]=0.977  spec[c4]=0.998  spec[c5]=0.966
Confusion matrix (LR val): rows=true, cols=pred
true\pred   ISUP0   ISUP1   ISUP2   ISUP3   ISUP4   ISUP5
    ISUP0       0    4746      89      74       6     123
    ISUP1       0    1114      36      32       2      18
    ISUP2       0     128      32      34       0      37
    ISUP3       0      55      15      13       1      31
    ISUP4       0      16       5       2       0      13
    ISUP5       0      36      15       7       1      15
  ↳ no improvement (2/10)
[017] train: loss 0.4668 bacc 0.5509 acc 0.2615 f1 0.4461 | val: loss 0.5511 acc 0.1620 BAL-acc 0.2731 f1 0.1128 | acc[c0]=0.000  acc[c1]=0.834  acc[c2]=0.169  acc[c3]=0.130  acc[c4]=0.222  acc[c5]=0.284 | auc[c0]=0.496  auc[c1]=0.529  auc[c2]=0.818  auc[c3]=0.828  auc[c4]=0.834  auc[c5]=0.795 | macroAUC=0.717 | macroSens=0.273 macroSpec=0.836 | sens[c0]=0.000  sens[c1]=0.834  sens[c2]=0.169  sens[c3]=0.130  sens[c4]=0.222  sens[c5]=0.284 | spec[c0]=1.000  spec[c1]=0.186  spec[c2]=0.963  spec[c3]=0.959  spec[c4]=0.973  spec[c5]=0.932
Confusion matrix (LR val): rows=true, cols=pred
true\pred   ISUP0   ISUP1   ISUP2   ISUP3   ISUP4   ISUP5
    ISUP0       0    4322     144     159     109     304
    ISUP1       0    1002      53      61      35      51
    ISUP2       0      93      39      44       6      49
    ISUP3       0      28      22      15      20      30
    ISUP4       0       6       4       2       8      16
    ISUP5       0      21      17       6       9      21
  ↳ saved best to /home/ewillis/projects/aip-medilab/ewillis/pca_contrastive/mri_model_medsam_finetune_2D/SPIE-no_attention/avgmax_results/baseline6/ckpt_best.pt (BAL-acc=0.2731)
[018] train: loss 0.3992 bacc 0.5779 acc 0.2741 f1 0.4632 | val: loss 0.8921 acc 0.1490 BAL-acc 0.2775 f1 0.1033 | acc[c0]=0.000  acc[c1]=0.745  acc[c2]=0.238  acc[c3]=0.148  acc[c4]=0.250  acc[c5]=0.284 | auc[c0]=0.549  auc[c1]=0.531  auc[c2]=0.795  auc[c3]=0.780  auc[c4]=0.813  auc[c5]=0.760 | macroAUC=0.705 | macroSens=0.278 macroSpec=0.836 | sens[c0]=0.000  sens[c1]=0.745  sens[c2]=0.238  sens[c3]=0.148  sens[c4]=0.250  sens[c5]=0.284 | spec[c0]=1.000  spec[c1]=0.284  spec[c2]=0.929  spec[c3]=0.933  spec[c4]=0.956  spec[c5]=0.915
Confusion matrix (LR val): rows=true, cols=pred
true\pred   ISUP0   ISUP1   ISUP2   ISUP3   ISUP4   ISUP5
    ISUP0       0    3839     303     292     198     406
    ISUP1       0     896      99      88      54      65
    ISUP2       0      59      55      55      10      52
    ISUP3       0      14      33      17      23      28
    ISUP4       0       6       5       1       9      15
    ISUP5       0      13      22       7      11      21
  ↳ saved best to /home/ewillis/projects/aip-medilab/ewillis/pca_contrastive/mri_model_medsam_finetune_2D/SPIE-no_attention/avgmax_results/baseline6/ckpt_best.pt (BAL-acc=0.2775)
[019] train: loss 0.3980 bacc 0.5838 acc 0.2765 f1 0.4729 | val: loss 0.1860 acc 0.1815 BAL-acc 0.2436 f1 0.1308 | acc[c0]=0.000  acc[c1]=0.938  acc[c2]=0.307  acc[c3]=0.052  acc[c4]=0.056  acc[c5]=0.108 | auc[c0]=0.439  auc[c1]=0.521  auc[c2]=0.840  auc[c3]=0.863  auc[c4]=0.870  auc[c5]=0.829 | macroAUC=0.727 | macroSens=0.244 macroSpec=0.836 | sens[c0]=0.000  sens[c1]=0.938  sens[c2]=0.307  sens[c3]=0.052  sens[c4]=0.056  sens[c5]=0.108 | spec[c0]=1.000  spec[c1]=0.077  spec[c2]=0.963  spec[c3]=0.996  spec[c4]=0.992  spec[c5]=0.986
Confusion matrix (LR val): rows=true, cols=pred
true\pred   ISUP0   ISUP1   ISUP2   ISUP3   ISUP4   ISUP5
    ISUP0       0    4820     134      16      24      44
    ISUP1       0    1128      55       4      11       4
    ISUP2       0     133      71       7       2      18
    ISUP3       0      60      19       6       9      21
    ISUP4       0      19       7       0       2       8
    ISUP5       0      39      21       1       5       8
  ↳ no improvement (1/10)
[020] train: loss 0.3985 bacc 0.5982 acc 0.2843 f1 0.4893 | val: loss 0.1697 acc 0.1792 BAL-acc 0.2281 f1 0.1129 | acc[c0]=0.000  acc[c1]=0.946  acc[c2]=0.186  acc[c3]=0.061  acc[c4]=0.000  acc[c5]=0.176 | auc[c0]=0.440  auc[c1]=0.526  auc[c2]=0.835  auc[c3]=0.855  auc[c4]=0.856  auc[c5]=0.824 | macroAUC=0.722 | macroSens=0.228 macroSpec=0.835 | sens[c0]=0.000  sens[c1]=0.946  sens[c2]=0.186  sens[c3]=0.061  sens[c4]=0.000  sens[c5]=0.176 | spec[c0]=1.000  spec[c1]=0.074  spec[c2]=0.972  spec[c3]=0.993  spec[c4]=0.999  spec[c5]=0.974
Confusion matrix (LR val): rows=true, cols=pred
true\pred   ISUP0   ISUP1   ISUP2   ISUP3   ISUP4   ISUP5
    ISUP0       0    4827      98      21       2      90
    ISUP1       0    1137      44       8       2      11
    ISUP2       0     142      43      16       0      30
    ISUP3       0      61      16       7       1      30
    ISUP4       0      17       7       0       0      12
    ISUP5       0      41      17       3       0      13
  ↳ no improvement (2/10)
[021] train: loss 0.3581 bacc 0.6227 acc 0.2957 f1 0.5092 | val: loss 0.2770 acc 0.1765 BAL-acc 0.2463 f1 0.1235 | acc[c0]=0.000  acc[c1]=0.910  acc[c2]=0.281  acc[c3]=0.096  acc[c4]=0.056  acc[c5]=0.135 | auc[c0]=0.467  auc[c1]=0.527  auc[c2]=0.827  auc[c3]=0.839  auc[c4]=0.846  auc[c5]=0.801 | macroAUC=0.718 | macroSens=0.246 macroSpec=0.836 | sens[c0]=0.000  sens[c1]=0.910  sens[c2]=0.281  sens[c3]=0.096  sens[c4]=0.056  sens[c5]=0.135 | spec[c0]=1.000  spec[c1]=0.112  spec[c2]=0.948  spec[c3]=0.986  spec[c4]=0.993  spec[c5]=0.974
Confusion matrix (LR val): rows=true, cols=pred
true\pred   ISUP0   ISUP1   ISUP2   ISUP3   ISUP4   ISUP5
    ISUP0       0    4660     206      51      23      98
    ISUP1       0    1094      71      14      11      12
    ISUP2       0     117      65      21       1      27
    ISUP3       0      49      25      11       6      24
    ISUP4       0      16       8       0       2      10
    ISUP5       0      34      24       3       3      10
  ↳ no improvement (3/10)
[022] train: loss 0.3455 bacc 0.6197 acc 0.2942 f1 0.5002 | val: loss 0.4754 acc 0.1649 BAL-acc 0.2619 f1 0.1097 | acc[c0]=0.000  acc[c1]=0.859  acc[c2]=0.104  acc[c3]=0.252  acc[c4]=0.194  acc[c5]=0.162 | auc[c0]=0.490  auc[c1]=0.529  auc[c2]=0.814  auc[c3]=0.821  auc[c4]=0.843  auc[c5]=0.794 | macroAUC=0.715 | macroSens=0.262 macroSpec=0.835 | sens[c0]=0.000  sens[c1]=0.859  sens[c2]=0.104  sens[c3]=0.252  sens[c4]=0.194  sens[c5]=0.162 | spec[c0]=1.000  spec[c1]=0.164  spec[c2]=0.977  spec[c3]=0.935  spec[c4]=0.973  spec[c5]=0.963
Confusion matrix (LR val): rows=true, cols=pred
true\pred   ISUP0   ISUP1   ISUP2   ISUP3   ISUP4   ISUP5
    ISUP0       0    4409      88     272     113     156
    ISUP1       0    1032      34      77      33      26
    ISUP2       0     104      24      64       7      32
    ISUP3       0      40      12      29      17      17
    ISUP4       0       9       6       3       7      11
    ISUP5       0      30      11      12       9      12
  ↳ no improvement (4/10)
[023] train: loss 0.3457 bacc 0.6362 acc 0.3052 f1 0.5227 | val: loss 0.4920 acc 0.1647 BAL-acc 0.2645 f1 0.1122 | acc[c0]=0.000  acc[c1]=0.844  acc[c2]=0.229  acc[c3]=0.157  acc[c4]=0.222  acc[c5]=0.135 | auc[c0]=0.504  auc[c1]=0.529  auc[c2]=0.809  auc[c3]=0.798  auc[c4]=0.816  auc[c5]=0.783 | macroAUC=0.706 | macroSens=0.264 macroSpec=0.836 | sens[c0]=0.000  sens[c1]=0.844  sens[c2]=0.229  sens[c3]=0.157  sens[c4]=0.222  sens[c5]=0.135 | spec[c0]=1.000  spec[c1]=0.188  spec[c2]=0.945  spec[c3]=0.948  spec[c4]=0.968  spec[c5]=0.968
Confusion matrix (LR val): rows=true, cols=pred
true\pred   ISUP0   ISUP1   ISUP2   ISUP3   ISUP4   ISUP5
    ISUP0       0    4304     236     229     130     139
    ISUP1       0    1014      71      56      45      16
    ISUP2       0      92      53      49       7      30
    ISUP3       0      34      23      18      20      20
    ISUP4       0      10       6       2       8      10
    ISUP5       0      23      21       9      11      10
  ↳ no improvement (5/10)
[024] train: loss 0.3509 bacc 0.6317 acc 0.3030 f1 0.5155 | val: loss 0.3994 acc 0.1682 BAL-acc 0.2451 f1 0.0968 | acc[c0]=0.000  acc[c1]=0.882  acc[c2]=0.052  acc[c3]=0.348  acc[c4]=0.000  acc[c5]=0.189 | auc[c0]=0.488  auc[c1]=0.530  auc[c2]=0.802  auc[c3]=0.827  auc[c4]=0.799  auc[c5]=0.809 | macroAUC=0.709 | macroSens=0.245 macroSpec=0.835 | sens[c0]=0.000  sens[c1]=0.882  sens[c2]=0.052  sens[c3]=0.348  sens[c4]=0.000  sens[c5]=0.189 | spec[c0]=1.000  spec[c1]=0.145  spec[c2]=0.987  spec[c3]=0.913  spec[c4]=1.000  spec[c5]=0.968
Confusion matrix (LR val): rows=true, cols=pred
true\pred   ISUP0   ISUP1   ISUP2   ISUP3   ISUP4   ISUP5
    ISUP0       0    4494      51     361       2     130
    ISUP1       0    1060      16     106       1      19
    ISUP2       0     108      12      80       0      31
    ISUP3       0      46       6      40       0      23
    ISUP4       0      14       3       8       0      11
    ISUP5       0      33       7      20       0      14
  ↳ no improvement (6/10)
[025] train: loss 0.3434 bacc 0.6493 acc 0.3100 f1 0.5345 | val: loss 0.2854 acc 0.1767 BAL-acc 0.2551 f1 0.1315 | acc[c0]=0.000  acc[c1]=0.907  acc[c2]=0.264  acc[c3]=0.183  acc[c4]=0.056  acc[c5]=0.122 | auc[c0]=0.467  auc[c1]=0.524  auc[c2]=0.823  auc[c3]=0.837  auc[c4]=0.853  auc[c5]=0.812 | macroAUC=0.719 | macroSens=0.255 macroSpec=0.836 | sens[c0]=0.000  sens[c1]=0.907  sens[c2]=0.264  sens[c3]=0.183  sens[c4]=0.056  sens[c5]=0.122 | spec[c0]=1.000  spec[c1]=0.110  spec[c2]=0.958  spec[c3]=0.970  spec[c4]=0.991  spec[c5]=0.986
Confusion matrix (LR val): rows=true, cols=pred
true\pred   ISUP0   ISUP1   ISUP2   ISUP3   ISUP4   ISUP5
    ISUP0       0    4673     165     118      35      47
    ISUP1       0    1090      61      35      13       3
    ISUP2       0     118      61      31       2      19
    ISUP3       0      49      20      21       9      16
    ISUP4       0      16       6       3       2       9
    ISUP5       0      35      19       8       3       9
  ↳ no improvement (7/10)
[026] train: loss 0.3182 bacc 0.6583 acc 0.3206 f1 0.5435 | val: loss 0.2243 acc 0.1794 BAL-acc 0.2427 f1 0.1240 | acc[c0]=0.000  acc[c1]=0.922  acc[c2]=0.281  acc[c3]=0.226  acc[c4]=0.000  acc[c5]=0.027 | auc[c0]=0.454  auc[c1]=0.522  auc[c2]=0.825  auc[c3]=0.851  auc[c4]=0.855  auc[c5]=0.822 | macroAUC=0.722 | macroSens=0.243 macroSpec=0.836 | sens[c0]=0.000  sens[c1]=0.922  sens[c2]=0.281  sens[c3]=0.226  sens[c4]=0.000  sens[c5]=0.027 | spec[c0]=1.000  spec[c1]=0.088  spec[c2]=0.959  spec[c3]=0.976  spec[c4]=0.996  spec[c5]=0.995
Confusion matrix (LR val): rows=true, cols=pred
true\pred   ISUP0   ISUP1   ISUP2   ISUP3   ISUP4   ISUP5
    ISUP0       0    4763     155      87      13      20
    ISUP1       0    1108      59      29       6       0
    ISUP2       0     131      65      32       0       3
    ISUP3       0      56      21      26       6       6
    ISUP4       0      21       9       3       0       3
    ISUP5       0      41      21       9       1       2
  ↳ no improvement (8/10)
[027] train: loss 0.3139 bacc 0.6829 acc 0.3298 f1 0.5575 | val: loss 0.7518 acc 0.1550 BAL-acc 0.2422 f1 0.0999 | acc[c0]=0.000  acc[c1]=0.788  acc[c2]=0.229  acc[c3]=0.191  acc[c4]=0.056  acc[c5]=0.189 | auc[c0]=0.533  auc[c1]=0.525  auc[c2]=0.795  auc[c3]=0.786  auc[c4]=0.786  auc[c5]=0.774 | macroAUC=0.700 | macroSens=0.242 macroSpec=0.835 | sens[c0]=0.000  sens[c1]=0.788  sens[c2]=0.229  sens[c3]=0.191  sens[c4]=0.056  sens[c5]=0.189 | spec[c0]=1.000  spec[c1]=0.223  spec[c2]=0.926  spec[c3]=0.935  spec[c4]=0.983  spec[c5]=0.945
Confusion matrix (LR val): rows=true, cols=pred
true\pred   ISUP0   ISUP1   ISUP2   ISUP3   ISUP4   ISUP5
    ISUP0       0    4135     308     281      80     234
    ISUP1       0     947     108      80      23      44
    ISUP2       0      82      53      53       1      42
    ISUP3       0      24      31      22       7      31
    ISUP4       0       7       9       3       2      15
    ISUP5       0      21      24      10       5      14
  ↳ no improvement (9/10)
[028] train: loss 0.2893 bacc 0.6716 acc 0.3250 f1 0.5551 | val: loss 0.2139 acc 0.1770 BAL-acc 0.2364 f1 0.1196 | acc[c0]=0.000  acc[c1]=0.923  acc[c2]=0.199  acc[c3]=0.174  acc[c4]=0.000  acc[c5]=0.122 | auc[c0]=0.465  auc[c1]=0.526  auc[c2]=0.817  auc[c3]=0.826  auc[c4]=0.832  auc[c5]=0.806 | macroAUC=0.712 | macroSens=0.236 macroSpec=0.835 | sens[c0]=0.000  sens[c1]=0.923  sens[c2]=0.199  sens[c3]=0.174  sens[c4]=0.000  sens[c5]=0.122 | spec[c0]=1.000  spec[c1]=0.091  spec[c2]=0.970  spec[c3]=0.971  spec[c4]=0.996  spec[c5]=0.984
Confusion matrix (LR val): rows=true, cols=pred
true\pred   ISUP0   ISUP1   ISUP2   ISUP3   ISUP4   ISUP5
    ISUP0       0    4749     114     109      11      55
    ISUP1       0    1110      45      38       6       3
    ISUP2       0     133      46      35       1      16
    ISUP3       0      58      13      20       5      19
    ISUP4       0      17       7       2       0      10
    ISUP5       0      39      17       8       1       9
  ↳ no improvement (10/10)
Early stopping at epoch 28.

=== Final model: Sensitivity at fixed specificity === (validation)
       class |          AUC |  Sens@Spec40 |  Sens@Spec60 |  Sens@Spec80 |  Sens@Spec90 |  Sens@Spec95 |  Sens@Spec99
          c0 |        0.549 |        0.656 |        0.476 |        0.277 |        0.154 |        0.082 |        0.020
          c1 |        0.531 |        0.629 |        0.448 |        0.238 |        0.123 |        0.061 |        0.013
          c2 |        0.795 |        0.970 |        0.874 |        0.580 |        0.325 |        0.186 |        0.048
          c3 |        0.780 |        1.000 |        0.835 |        0.504 |        0.322 |        0.113 |        0.026
          c4 |        0.813 |        0.972 |        0.833 |        0.667 |        0.417 |        0.306 |        0.056
          c5 |        0.760 |        0.973 |        0.797 |        0.473 |        0.297 |        0.149 |        0.081
       macro |        0.705 |        0.867 |        0.711 |        0.456 |        0.273 |        0.149 |        0.041
[TEST] loss 0.7858 acc 0.1396 f1 0.1106 | acc[c0]=0.000  acc[c1]=0.753  acc[c2]=0.215  acc[c3]=0.194  acc[c4]=0.381  acc[c5]=0.296 | auc[c0]=0.558  auc[c1]=0.518  auc[c2]=0.730  auc[c3]=0.786  auc[c4]=0.837  auc[c5]=0.749 | macroAUC=0.696 | macroSens=0.306 macroSpec=0.836 | sens[c0]=0.000  sens[c1]=0.753  sens[c2]=0.215  sens[c3]=0.194  sens[c4]=0.381  sens[c5]=0.296 | spec[c0]=1.000  spec[c1]=0.260  spec[c2]=0.930  spec[c3]=0.944  spec[c4]=0.956  spec[c5]=0.925
Confusion matrix (LR val): rows=true, cols=pred
true\pred   ISUP0   ISUP1   ISUP2   ISUP3   ISUP4   ISUP5
    ISUP0       0    4049     325     254     195     333
    ISUP1       0     826      95      73      37      66
    ISUP2       0      91      61      33      29      70
    ISUP3       0      27      20      25      31      26
    ISUP4       0       4       7       6      16       9
    ISUP5       0      20       7       5       6      16

=== Final model: Sensitivity at fixed specificity === (test)
       class |          AUC |  Sens@Spec40 |  Sens@Spec60 |  Sens@Spec80 |  Sens@Spec90 |  Sens@Spec95 |  Sens@Spec99
          c0 |        0.558 |        0.672 |        0.489 |        0.292 |        0.148 |        0.080 |        0.017
          c1 |        0.518 |        0.617 |        0.427 |        0.242 |        0.121 |        0.055 |        0.012
          c2 |        0.730 |        0.905 |        0.729 |        0.489 |        0.285 |        0.158 |        0.025
          c3 |        0.786 |        0.961 |        0.868 |        0.527 |        0.318 |        0.178 |        0.047
          c4 |        0.837 |        0.952 |        0.857 |        0.690 |        0.571 |        0.405 |        0.119
          c5 |        0.749 |        0.907 |        0.778 |        0.574 |        0.370 |        0.204 |        0.019
       macro |        0.696 |        0.836 |        0.691 |        0.469 |        0.302 |        0.180 |        0.040
wandb:                                                                                
wandb: 
wandb: Run history:
wandb:             aux/lr ▁▁▁▁▁▁▁▁▁▁▁▁▁▁▁▁▁▁▁▁▁▁▁▁▁▁▁▁
wandb: aux/test/macro_tnr ▁
wandb: aux/test/macro_tpr ▁
wandb:      aux/train/acc ▁▁▁▂▂▃▃▃▄▄▄▅▅▅▅▅▆▆▆▇▇▇▇▇▇███
wandb: aux/train/f1_macro ▁▁▂▃▃▄▄▄▅▅▅▅▆▆▆▆▇▇▇▇▇▇█▇████
wandb:  aux/val/macro_tnr ▁▁▂▆▃▃▄▆▄▆▇▄▅▆▆▆▇█▇▆█▆█▇█▇▆▆
wandb:  aux/val/macro_tpr ▁▁▂▆▃▄▄▆▅▆▆▃▅▇▆▅██▆▅▆▇▇▆▇▆▆▅
wandb:              epoch ▁▁▁▂▂▂▂▂▂▃▃▃▃▃▄▄▄▄▄▄▅▅▅▅▅▅▆▆█
wandb:        test/acc_c0 ▁
wandb:        test/acc_c1 ▁
wandb:                +30 ...
wandb: 
wandb: Run summary:
wandb:             aux/lr 1e-05
wandb: aux/test/macro_tnr 0.83578
wandb: aux/test/macro_tpr 0.30647
wandb:      aux/train/acc 0.325
wandb: aux/train/f1_macro 0.5551
wandb:  aux/val/macro_tnr 0.83533
wandb:  aux/val/macro_tpr 0.23635
wandb:              epoch 40
wandb:        test/acc_c0 0
wandb:        test/acc_c1 0.75296
wandb:                +30 ...
wandb: 
wandb: 🚀 View run fixed-dims-noattn-isup6 at: https://wandb.ai/jesande7-queens/mri-training/runs/3vir3w6p
wandb: ⭐️ View project at: https://wandb.ai/jesande7-queens/mri-training
wandb: Synced 5 W&B file(s), 0 media file(s), 0 artifact file(s) and 0 other file(s)
wandb: Find logs at: ./wandb/run-20251215_001029-3vir3w6p/logs
